{
  "$schema": "../schema/framework-coverage.schema.json",
  "framework_id": "apra_cps_234",
  "framework_name": "APRA CPS 234",
  "metadata": {
    "source": "SP800-53v5_Control_Mappings",
    "version": "2.0",
    "disclaimer": "Based on publicly available crosswalks and expert analysis. Incorporates new SP 800-53 Rev 5 controls where they genuinely improve coverage. Validate with qualified assessors for compliance/audit use.",
    "jurisdictions": [
      "AU"
    ],
    "applicability_type": "mandatory"
  },
  "weight_scale": {
    "full": {
      "min": 85,
      "max": 100,
      "label": "Fully addressed"
    },
    "substantial": {
      "min": 65,
      "max": 84,
      "label": "Well addressed, notable gaps"
    },
    "partial": {
      "min": 40,
      "max": 64,
      "label": "Partially addressed"
    },
    "weak": {
      "min": 1,
      "max": 39,
      "label": "Weakly addressed"
    },
    "none": {
      "min": 0,
      "max": 0,
      "label": "No mapping"
    }
  },
  "clauses": [
    {
      "id": "Para 15",
      "title": "An APRA-regulated entity must maintain an information security capability commensurate with the size and extent of threats to its information assets",
      "controls": [
        "PM-01",
        "PM-03",
        "PM-13",
        "PM-09",
        "PL-09",
        "PL-10",
        "RA-07"
      ],
      "coverage_pct": 78,
      "rationale": "PM-01 security program; PM-03 resources; PM-13 workforce; PM-09 risk strategy. PL-09 (new in Rev 5) central management enables unified security control governance commensurate with entity size; PL-10 (new in Rev 5) baseline selection supports proportionate control selection. RA-07 (new in Rev 5) risk response strengthens threat-commensurate response actions.",
      "gaps": "CPS 234 requires capability commensurate with threats. PL-09/PL-10 improve proportionality through central management and baseline selection. However, the CPS 234 concept of proportionate capability assessment tied to entity size and threat landscape remains more explicit than SP 800-53's approach."
    },
    {
      "id": "Para 16-17",
      "title": "Board must ensure adequate maintenance of information security, senior management implement information security controls",
      "controls": [
        "PM-01",
        "PM-02",
        "PS-09"
      ],
      "coverage_pct": 68,
      "rationale": "PM-01 program plan; PM-02 senior security role. PS-09 (new in Rev 5) position descriptions incorporates security responsibilities into organizational positions, strengthening the link between senior management roles and security accountability.",
      "gaps": "CPS 234 places specific obligations on the Board and senior management for information security maintenance. PS-09 improves role definition but Australian regulatory board accountability requirements (board approval of security strategy, board-level reporting) need supplementation."
    },
    {
      "id": "Para 18",
      "title": "Clearly defined information security-related roles and responsibilities",
      "controls": [
        "PM-02",
        "PS-01",
        "PS-02",
        "PL-01",
        "PS-09"
      ],
      "coverage_pct": 88,
      "rationale": "PM-02 role assignment; PS-01/PS-02 personnel roles; PL-01 planning roles. PS-09 (new in Rev 5) position descriptions explicitly requires security responsibilities in role descriptions, directly strengthening CPS 234 compliance for defined roles.",
      "gaps": "Minor: PS-09 closes the primary gap from v1.0 by formalizing security in position descriptions. CPS 234 board/senior management role definitions may still need supplementation."
    },
    {
      "id": "Para 19-20",
      "title": "Maintain information security capability to manage information security vulnerabilities and threats commensurate with threats",
      "controls": [
        "PM-13",
        "AT-02",
        "AT-03",
        "PM-03",
        "RA-05",
        "SI-02",
        "AT-06",
        "RA-07"
      ],
      "coverage_pct": 82,
      "rationale": "PM-13 workforce; AT-02/AT-03 training; PM-03 resources; RA-05 vulnerability management; SI-02 remediation. AT-06 (new in Rev 5) training feedback measures training effectiveness, supporting capability maintenance. RA-07 (new in Rev 5) risk response provides explicit threat-commensurate response actions.",
      "gaps": "Minor: AT-06 improves capability measurement through training feedback. RA-07 strengthens threat response. CPS 234 emphasis on continuous capability maintenance commensurate with evolving threats is now better addressed but the proportionality concept remains implicit."
    },
    {
      "id": "Para 21",
      "title": "Information asset identification and classification",
      "controls": [
        "RA-02",
        "CM-08",
        "PM-05",
        "CM-12",
        "CM-13"
      ],
      "coverage_pct": 90,
      "rationale": "RA-02 security categorization; CM-08 component inventory; PM-05 system inventory. CM-12 (new in Rev 5) information location identifies where information assets reside across systems. CM-13 (new in Rev 5) data action mapping documents data processing flows, strengthening identification of information assets managed by third parties.",
      "gaps": "Minor: CM-12/CM-13 significantly improve asset identification including information managed by related parties and third parties. CPS 234 asset classification is now well addressed."
    },
    {
      "id": "Para 22-23",
      "title": "Information security controls must protect information assets commensurate with criticality and sensitivity, and be subject to testing",
      "controls": [
        "AC-02",
        "AC-03",
        "AC-06",
        "AC-17",
        "SC-07",
        "SC-08",
        "SC-12",
        "SC-13",
        "SC-28",
        "SI-02",
        "SI-03",
        "SI-04",
        "SI-07",
        "AU-02",
        "AU-03",
        "AU-06",
        "AU-09",
        "AU-12",
        "CA-02",
        "CA-08",
        "SC-45",
        "SI-16"
      ],
      "coverage_pct": 87,
      "rationale": "AC family access controls; SC family communications protection; SI family integrity; AU family audit and accountability; CA-02 assessments; CA-08 penetration testing. SC-45 (new in Rev 5) system time synchronization ensures correlated audit evidence. SI-16 (new in Rev 5) memory protection strengthens technical controls for sensitive assets.",
      "gaps": "Minor: SC-45 and SI-16 add depth to technical protection and audit correlation. CPS 234 testing program requirements are well addressed through CA family."
    },
    {
      "id": "Para 24",
      "title": "Testing by an independent party",
      "controls": [
        "CA-02",
        "CA-08"
      ],
      "coverage_pct": 85,
      "rationale": "CA-02(1) independent assessors; CA-08(1) independent penetration agent.",
      "gaps": "Minor: CPS 234 requires testing by independent specialists where warranted. Well addressed by CA enhancements."
    },
    {
      "id": "Para 25",
      "title": "Notify APRA of material information security incidents",
      "controls": [
        "IR-06",
        "IR-09"
      ],
      "coverage_pct": 67,
      "rationale": "IR-06 incident reporting. IR-09 (new in Rev 5) information spillage response adds specific procedures for data exposure incidents, which may constitute material incidents under CPS 234.",
      "gaps": "CPS 234 requires specific notification to APRA within 72 hours for material incidents and within 10 business days for control weaknesses. IR-09 improves handling of data spillage incidents. APRA-specific timelines and materiality thresholds remain regulatory requirements outside SP 800-53 scope."
    },
    {
      "id": "Para 26",
      "title": "Notify APRA of material information security control weaknesses",
      "controls": [
        "CA-05",
        "IR-06",
        "PM-04",
        "RA-07"
      ],
      "coverage_pct": 62,
      "rationale": "CA-05 POA&M; IR-06 reporting; PM-04 plan of action tracking. RA-07 (new in Rev 5) risk response provides structured treatment of identified control weaknesses including accept, mitigate, transfer.",
      "gaps": "CPS 234 requires notifying APRA of control weaknesses that cannot be remediated in a timely manner. RA-07 improves structured risk response but APRA-specific notification requirements for unresolved weaknesses are regulatory and need supplementation."
    },
    {
      "id": "Para 27-28",
      "title": "Internal audit review of information security controls",
      "controls": [
        "CA-02",
        "PM-06"
      ],
      "coverage_pct": 80,
      "rationale": "CA-02 security assessments with independent assessor; PM-06 performance measurement.",
      "gaps": "Minor: CPS 234 requires internal audit to review the design and operating effectiveness of information security controls. SP 800-53 covers assessment but internal audit-specific requirements are less detailed."
    },
    {
      "id": "Para 29-33",
      "title": "Related party and third party arrangements",
      "controls": [
        "SA-04",
        "SA-09",
        "SR-01",
        "SR-03",
        "SR-06",
        "SA-21"
      ],
      "coverage_pct": 78,
      "rationale": "SA-04 acquisition; SA-09 external services; SR family supply chain. SA-21 (new in Rev 5) developer screening adds personnel vetting for third-party development teams, strengthening CPS 234 third-party capability assessment.",
      "gaps": "CPS 234 has specific requirements for related party and third party information security capability assessment. SA-21 improves third-party personnel vetting. The CPS 234-specific 'related party' concept and ongoing assessment requirements still need supplementation."
    }
  ],
  "summary": {
    "total_clauses": 11,
    "average_coverage": 78.6,
    "full_count": 4,
    "substantial_count": 6,
    "partial_count": 1,
    "weak_count": 0,
    "none_count": 0
  }
}
